{
  "@context": [
    "https://www.w3.org/2018/credentials/v1",
    "https://base.uri.europass/contexts/v1"
  ],
  "type": ["VerifiableCredential", "VerifiableAttestation", "Europass"],
  "id": "urn:credential:5a4d5412-27e3-4540-a5e5-f1aa4d55b20c",
  "issuer": "did:epass:org:1",
  "issuanceDate": "2020-07-20T13:58:53+02:00",
  "issued": "2020-07-20T13:58:53+02:00",
  "validFrom": "2019-09-20T00:00:00+02:00",
  "credentialSubject": {
    "id": "did:epass:person:1",
    "identifier": [
      {
        "schemeID": "Student identification number",
        "value": 99009900
      }
    ],
    "achieved": [
      {
        "id": "urn:epass:learningAchievement:1",
        "title": "Data and software business",
        "wasDerivedFrom": [
          {
            "id": "urn:epass:assessment:1",
            "title": "Overall grade",
            "grade": "excellent (5)",
            "specifiedBy": {
              "id": "urn:epass:asssessmentspec:1",
              "title": "Overall grade",
              "gradingScheme": {
                "id": "urn:epass:scoringschemespec:1",
                "title": "General grading scheme in Finland",
                "definition": "The Finnish national grading scheme consists of five grades with numerical equivalents: 5 (outstanding); 4 (very good); 3 (good); 2 (sufficient); 1 (insufficient - fail). The minimum passing grade is 2."
              }
            },
            "hasPart": [
              {
                "id": "urn:epass:assessment:2",
                "title": "individual assignment 1",
                "grade": "excellent (5)",
                "specifiedBy": {
                  "id": "urn:epass:asssessmentspec:2",
                  "title": "individual assignment 1",
                  "gradingScheme": {
                    "id": "urn:epass:scoringschemespec:2",
                    "title": "General grading scheme in Finland",
                    "definition": "The Finnish national grading scheme consists of five grades with numerical equivalents: 5 (outstanding); 4 (very good); 3 (good); 2 (sufficient); 1 (insufficient - fail). The minimum passing grade is 2."
                  }
                }
              },
              {
                "id": "urn:epass:assessment:3",
                "title": "individual assignment 2",
                "grade": "excellent (5)",
                "specifiedBy": {
                  "id": "urn:epass:asssessmentspec:3",
                  "title": "individual assignment 2",
                  "gradingScheme": {
                    "id": "urn:epass:scoringschemespec:3",
                    "title": "General grading scheme in Finland",
                    "definition": "The Finnish national grading scheme consists of five grades with numerical equivalents: 5 (outstanding); 4 (very good); 3 (good); 2 (sufficient); 1 (insufficient - fail). The minimum passing grade is 2."
                  }
                }
              },
              {
                "id": "urn:epass:assessment:4",
                "title": "Project assignment",
                "grade": "excellent (5)",
                "specifiedBy": {
                  "id": "urn:epass:asssessmentspec:4",
                  "title": "Project assignment",
                  "gradingScheme": {
                    "id": "urn:epass:scoringschemespec:4",
                    "title": "General grading scheme in Finland",
                    "definition": "The Finnish national grading scheme consists of five grades with numerical equivalents: 5 (outstanding); 4 (very good); 3 (good); 2 (sufficient); 1 (insufficient - fail). The minimum passing grade is 2."
                  }
                }
              }
            ]
          }
        ],
        "specifiedBy": [
          {
            "id": "urn:epass:learningSpecification:1",
            "title": "Data and Software Business",
            "Definition": "formal learning",
            "hasECTSCreditPoints": "5",
            "learningSetting": "http://data.europa.eu/snb/learning-setting/6fd4685715",
            "learningOutcomes": [
              {
                "id": "urn:epass:learningOutcome:1",
                "name": "Basic principles of data and software business",
                "definition": "Student understands the basic principles of data and software business, and the special characteristics of software industry",
                "relatedESCOSkill": [
                  "http://data.europa.eu/esco/skill/943d07ec-fb75-4bb5-bc07-20451a2b66e4",
                  "http://data.europa.eu/esco/skill/7dd94ad3-13d6-43fe-8b94-51fcbf67ced9",
                  "http://data.europa.eu/esco/skill/fcb2b5f4-3a64-42f2-987a-073bea986104"
                ]
              },
              {
                "id": "urn:epass:learningOutcome:2",
                "name": "Monetizing with data and software",
                "definition": "He/she can critically analyse how it is possible to monetize with data and software",
                "relatedESCOSkill": [
                  "http://data.europa.eu/esco/skill/c624c6a3-b0ba-4a31-a296-0d433fe47e41"
                ]
              },
              {
                "id": "urn:epass:learningOutcome:3",
                "name": "Collaboratively develop a data or software concept",
                "definition": "He/she can analyze the feasibility of software business models. Student can apply theoretical knowledge and understanding of the data and software business characteristics to collaboratively create a solid lean canvas model for a software start-up.",
                "relatedESCOSkill": [
                  "http://data.europa.eu/esco/skill/60c78287-22eb-4103-9c8c-28deaa460da0",
                  "http://data.europa.eu/esco/skill/09e28145-e205-4b7a-8b3b-5c4876396069",
                  "http://data.europa.eu/esco/skill/27ed854c-15b8-4ba2-90e9-ae888a219703"
                ]
              }
            ]
          }
        ]
      }
    ],
    "wasInfluencedBy": [
      {
        "id": "urn:epass:activity:1",
        "identifier": [
          {
            "schemeID": "Activity ID",
            "value": "GAB701"
          }
        ],
        "title": "Individual exercise",
        "Description": "The individual exercise is a written task that has two parts: 1. Choose 1 main lecture topic to focus on 2. Choose 2 guest lectures to focus on-Access the documentation in Moodle and answer the according questions in your own time (by the 5th of October) -Each task requires some self-learning, such as finding suitable examples for typical revenue streams and so on. -Return your answers in one document and upload to Moodle (note. Plagiarism tested automatically). The individual assignment accounts for 40% of the final grade.",
        "specifiedBy": {
          "id": "urn:epass:learningactivityspec:1",
          "title": "Individual exercise",
          "learningActivityType": [
            "http://data.europa.eu/snb/learning-activity/bf2e3a7bae"
          ],
          "language": [
            "http://publications.europa.eu/resource/authority/language/ENG"
          ]
        }
      },
      {
        "id": "urn:epass:activity:2",
        "identifier": [
          {
            "schemeID": "Activity ID",
            "value": "GAE701"
          }
        ],
        "title": "Course exercise",
        "Description": "Minimum viable product (MVP) Concept to explore product-market fit. Students will Identify the topic area of their MVP (Data-, platform-, product-Or service business), sketch their MVP (Use lean business model canvas), present and then report on their MVP. 3-5 people, 4 weeks remote collaboration, pitching of MVPs in a final event together with Business Tampere and Start-up centre Tribe. The course exercise accounts for 60% of the final grade",
        "specifiedBy": {
          "id": "urn:epass:learningactivityspec:2",
          "title": "Group exercise",
          "learningActivityType": [
            "http://data.europa.eu/snb/learning-activity/bf2e3a7bae"
          ],
          "language": [
            "http://publications.europa.eu/resource/authority/language/ENG"
          ]
        }
      },
      {
        "id": "urn:epass:activity:3",
        "identifier": [
          {
            "schemeID": "Activity ID",
            "value": "GAO701"
          }
        ],
        "title": "Zoom lecture",
        "Description": "includes both basic lectures on data and software business and guest lectures by companies.",
        "specifiedBy": {
          "id": "urn:epass:learningactivityspec:3",
          "title": "Zoom lectures",
          "learningActivityType": [
            "http://data.europa.eu/snb/learning-activity/bf2e3a7bae"
          ],
          "language": [
            "http://publications.europa.eu/resource/authority/language/ENG"
          ]
        }
      }
    ]
  },
  "credentialStatus": {
    "id": "https://uri.to.status",
    "type": "TrustedCredentialStatus2021"
  },
  "credentialSchema": {
    "id": "https://uri.to.schema",
    "type": "FullJsonSchemaValidator2021"
  }
}
