{
  "@context": [
    "https://www.w3.org/2018/credentials/v1",
    "https://essif.europa.eu/schemas/vc/2020/v1"
  ],
  "type": ["VerifiableCredential", "VerifiableAttestation", "Europass"],
  "expirationDate": "2023-03-04T14:50:55Z",
  "id": "urn:credential:rntuo:908ae789-2b27-44f6-b62e-b2fc0ab4e886",
  "issued": "2022-03-04T14:50:55Z",
  "issuer": "did:ebsi:zjAmQ2qyJvZ7sLXWhdtDF8K",
  "validFrom": "2022-03-04T14:50:55Z",
  "issuanceDate": "2022-03-04T14:50:55Z",
  "credentialSubject": {
    "achieved": [
      {
        "id": "urn:epass:learningAchievement:1",
        "identifier": [
          {
            "schemeID": "RNTUO Certificate ID",
            "value": "2020016696"
          }
        ],
        "specifiedBy": [
          {
            "id": "urn:epass:qualification:1",
            "eqflLevel": "http://data.europa.eu/snb/eqf/7",
            "title": "Máster Universitario en Asuntos Internacionales: Economía, Política y Derecho por la Universidad Pontificia Comillas"
          }
        ],
        "title": "Máster Universitario en Asuntos Internacionales: Economía, Política y Derecho por la Universidad Pontificia Comillas",
        "wasAwardedBy": {
          "awardingBody": [
            "Universidad Pontificia Comillas (Universidad de la Iglesia Católica)"
          ],
          "awardingDate": "2019-09-11T00:00:00Z",
          "awardingLocation": ["https://essif.europa.eu/madrid"],
          "id": "urn:epass:awardingProcess:1"
        }
      }
    ],
    "id": "did:ebsi:zrn14Vr8Uuz54iAiUpfgyJS"
  },
  "credentialStatus": {
    "id": "https://essif.europa.eu/status/43",
    "type": "CredentialsStatusList2020"
  },
  "credentialSchema": {
    "id": "https://api-test.ebsi.eu/trusted-schemas-registry/v2/schemas/0x928c0ebb5cfc72c70e1273812eb16f67fa492c52ac9c6330f5e94374d2f48502",
    "type": "FullJsonSchemaValidator2021"
  }
}
