{
    "@context": ["https://www.w3.org/2018/credentials/v1"],
    "id": "urn:uuid:003a1dd8-a5d2-42ef-8182-e921c0a9f2cd",
    "type": ["VerifiableCredential", "VerifiableAttestation", "StudentId"],
    "issuer": "did:ebsi:00001234",
    "issuanceDate": "2021-11-01T00:00:00Z",
    "validFrom": "2021-11-01T00:00:00Z",
    "expirationDate": "2024-06-22T14:11:44Z",
    "issued": "2020-06-22T14:11:44Z",
    "credentialSubject": {
        "id": "did:ebsi:00001235",
        "personalIdentifier": "123456"
    },
    "credentialSchema": {
        "id": "https://api-pilot.ebsi.eu/trusted-schemas-registry/v1/schemas/0x6ff8cdf21b3969222e4a799d9605997b0f1de7d49edcde4ad0c09eb636dfaf3c",
        "type": "FullJsonSchemaValidator2021"
    }
}
