{
  "@context": [
    "https://www.w3.org/2018/credentials/v1",
    "https://base.uri.europass/contexts/v1"
  ],
  "type": ["VerifiableCredential", "VerifiableAttestation", "Europass"],
  "id": "urn:credential:5a4d5412-27e3-4540-a5e5-f1aa4d55b20c",
  "issuer": "did:epass:org:1",
  "issuanceDate": "2020-07-20T13:58:53+02:00",
  "issued": "2020-07-20T13:58:53+02:00",
  "validFrom": "2019-09-20T00:00:00+02:00",
  "credentialSubject": {
    "id": "did:epass:person:1",
    "achieved": [
      {
        "id": "urn:epass:learningAchievement:1",
        "identifier": [
          {
            "schemeID": "University Record Identifier",
            "value": "123456"
          }
        ],
        "title": "TITLE OF PROGRAMME",
        "specifiedBy": [
          {
            "id": "urn:epass:qualification:1",
            "title": "Title of Achievement"
          }
        ],
        "wasInfluencedBy": [
          {
            "id": "urn:epass:activity:1",
            "title": "Coursework",
            "startedAtTime": "2022-03-04T14:50:55Z",
            "endedAtTime": "2022-03-04T14:50:55Z"
          }
        ]
      }
    ]
  },
  "credentialStatus": {
    "id": "https://essif.europa.eu/status/43",
    "type": "CredentialsStatusList2020"
  },
  "credentialSchema": {
    "id": "https://api-test.ebsi.eu/trusted-schemas-registry/v2/schemas/0x928c0ebb5cfc72c70e1273812eb16f67fa492c52ac9c6330f5e94374d2f48502",
    "type": "FullJsonSchemaValidator2021"
  }
}
